{
    "$schema": "../project.schema.json",
    "title": "Exploramap App",
    "description": "Exploration gamification cross-platform application based on GPS and OpenStreetMap data.",
    "aspiration": "Dive into mobile and cross-platform development. Focus on design and user experience and build something that could evolve into a side-business.",
    "skills": [
        "android",
        "dart",
        "flutter",
        "github_actions",
        "glsl",
        "gradle",
        "kotlin",
        "notion"
    ],
    "lastActivity": "2024-01-25",
    "status": "Semi-active"
}
