{
    "$schema": "../project.schema.json",
    "title": "Cookbook",
    "description": "System-driven recipe server supporting actual cookie recipes as well as other recipe-based domains (games, production lines, etc).",
    "aspiration": "Started as a way to explore the Go language, but was abandoned when I realized Go was not well-suited for the project.",
    "skills": [
        "golang",
        "javascript"
    ],
    "lastActivity": "2022-06-15",
    "status": "Abandoned (for now)"
}
