{
    "$schema": "../project.schema.json",
    "title": "Trains!",
    "description": "A game strongly inspired by Sid Mier's Railroads, written from scratch using C++ standard library and OpenGL. Highlights included writing a bespoke SIMD-optimized linear algebra library. Unfortunately the project died due to a drive failure and I did not use a version control system at the time.",
    "aspiration": "Learn graphics processing and game development.",
    "skills": [
        "C++",
        "OpenGL",
        "GLSL",
        "x86asm",
        "windows"
    ],
    "lastActivity": "2017-06-17",
    "status": "Dead due to lost source code"
}
