{
    "$schema": "../project.schema.json",
    "title": "A minecraft mod",
    "description": "Minecraft mod adding more blocks to the base game with custom hitboxes and graphical effects. Culminanted in data-driven generation system where users could add new blocks with custom looks, properties and hitboxes by creating a json file. The idea became redundant once Minecraft 1.0 was released along with more powerful resource-packs.",
    "aspiration": "Learn collaborative programming and working with end-users.",
    "skills": [
        "java"
    ],
    "lastActivity": "2014-07-20",
    "status": "Redundant"
}
